{
  "position_title": "Software Engineering Intern",
  "categories": [
    {
      "key": "work_experience",
      "label": "Work Experience",
      "max": 35,
      "icon": "💼"
    },
    {
      "key": "technical_skills",
      "label": "Technical Skills",
      "max": 35,
      "icon": "💻"
    },
    {
      "key": "education",
      "label": "Education",
      "max": 15,
      "icon": "🎓"
    },
    {
      "key": "project_impact",
      "label": "Project Impact",
      "max": 15,
      "icon": "🚀"
    }
  ],
  "bonus_max": 10,
  "min_final_score": 0,
  "max_final_score": 110
}
